{
  "module": "META",
  "id": "7232",
  "version": "2.0",
  "axiom_count": 100,
  "meta_formula": "Φ_META = Ω_ONT · Ω_EPI · Ω_AXI · Ψ(U, ω, ρ, σ) · Γ · τ · ∂ · μ · κ · λ",
  "categories": {
    "ontology": {
      "range": [1, 25],
      "prefix": "ONT",
      "description": "Was existiert? Grundlegende Entitäten und Beziehungen"
    },
    "epistemology": {
      "range": [26, 50],
      "prefix": "EPI",
      "description": "Was wissen wir? Wissen, Unsicherheit, Grenzen"
    },
    "governance": {
      "range": [51, 75],
      "prefix": "GOV",
      "description": "Was ist erlaubt? Regeln, Constraints, Ethik"
    },
    "dynamics": {
      "range": [76, 100],
      "prefix": "DYN",
      "description": "Wie verändert es sich? Zeit, Evolution, Adaptation"
    }
  },
  "axioms": [
    {
      "id": "MA-ONT-01",
      "category": "ontology",
      "level": "foundation",
      "statement": "∃ σ: Subjekt existiert",
      "description": "Es existiert mindestens ein Entscheidungssubjekt",
      "formula": "σ ∈ Σ, |Σ| ≥ 1",
      "dependencies": [],
      "validates": ["INU", "KNU", "IDN"],
      "testable": false
    },
    {
      "id": "MA-ONT-02",
      "category": "ontology",
      "level": "foundation",
      "statement": "∃ V: Verhalten existiert",
      "description": "Es gibt beobachtbare Verhaltensweisen",
      "formula": "V ∈ V, |V| ≥ 1",
      "dependencies": ["MA-ONT-01"],
      "validates": ["WTX"],
      "testable": true
    },
    {
      "id": "MA-ONT-03",
      "category": "ontology",
      "level": "foundation",
      "statement": "∃ U: Nutzen existiert",
      "description": "Subjekte haben Nutzenfunktionen",
      "formula": "U: V × σ → ℝ",
      "dependencies": ["MA-ONT-01", "MA-ONT-02"],
      "validates": ["INU"],
      "testable": true
    },
    {
      "id": "MA-ONT-04",
      "category": "ontology",
      "level": "foundation",
      "statement": "∃ ρ: Kontext existiert",
      "description": "Verhalten findet in Kontexten statt",
      "formula": "ρ ∈ P, |P| ≥ 1",
      "dependencies": ["MA-ONT-02"],
      "validates": ["INU", "KNU", "IDN"],
      "testable": true
    },
    {
      "id": "MA-ONT-05",
      "category": "ontology",
      "level": "foundation",
      "statement": "∃ τ: Zeit existiert",
      "description": "Verhalten hat temporale Dimension",
      "formula": "τ ∈ T, T ⊆ ℝ⁺",
      "dependencies": ["MA-ONT-02"],
      "validates": ["WTX"],
      "testable": true
    },
    {
      "id": "MA-ONT-06",
      "category": "ontology",
      "level": "foundation",
      "statement": "∃ Γ: Constraints existieren",
      "description": "Es gibt Beschränkungen für Verhalten",
      "formula": "Γ: V → {0, 1}",
      "dependencies": ["MA-ONT-02"],
      "validates": ["GOV"],
      "testable": true
    },
    {
      "id": "MA-ONT-07",
      "category": "ontology",
      "level": "structure",
      "statement": "U = U_INU ⊕ U_KNU ⊕ U_IDN",
      "description": "Nutzen hat drei Komponenten: Individuell, Kollektiv, Identität",
      "formula": "U = Ψ(U_INU, U_KNU, U_IDN)",
      "dependencies": ["MA-ONT-03"],
      "validates": ["INU", "KNU", "IDN"],
      "testable": true
    },
    {
      "id": "MA-ONT-08",
      "category": "ontology",
      "level": "structure",
      "statement": "FEPSDE: 6 Nutzen-Dimensionen",
      "description": "Financial, Emotional, Physical, Social, Digital, Ecological",
      "formula": "U_INU = Σ_d∈FEPSDE ω_d · u_d",
      "dependencies": ["MA-ONT-07"],
      "validates": ["INU"],
      "testable": true
    },
    {
      "id": "MA-ONT-09",
      "category": "ontology",
      "level": "structure",
      "statement": "∃ I: Identitäten sind multipel",
      "description": "Subjekte haben multiple Identitäten",
      "formula": "I_σ = {I_1, I_2, ..., I_n}, n ≥ 1",
      "dependencies": ["MA-ONT-01"],
      "validates": ["IDN"],
      "testable": true
    },
    {
      "id": "MA-ONT-10",
      "category": "ontology",
      "level": "structure",
      "statement": "∃ G: Gruppen existieren",
      "description": "Subjekte gehören zu Gruppen",
      "formula": "G ⊆ P(Σ), σ ∈ G_i",
      "dependencies": ["MA-ONT-01"],
      "validates": ["KNU"],
      "testable": true
    },
    {
      "id": "MA-ONT-11",
      "category": "ontology",
      "level": "structure",
      "statement": "∃ N: Normen existieren",
      "description": "Gruppen haben soziale Normen",
      "formula": "N: G × V → [0, 1]",
      "dependencies": ["MA-ONT-10"],
      "validates": ["KNU"],
      "testable": true
    },
    {
      "id": "MA-ONT-12",
      "category": "ontology",
      "level": "structure",
      "statement": "∃ κ: Komplementarität existiert",
      "description": "Gegensätze bedingen sich gegenseitig",
      "formula": "κ: (A, B) → ℝ, κ(A, B) = κ(B, A)",
      "dependencies": ["MA-ONT-07"],
      "validates": ["META"],
      "testable": true
    },
    {
      "id": "MA-ONT-13",
      "category": "ontology",
      "level": "operation",
      "statement": "Ψ: Kohärenz-Operator",
      "description": "Kombination von Nutzen ist nicht-additiv",
      "formula": "Ψ(U) ≠ Σ U_i (im Allgemeinen)",
      "dependencies": ["MA-ONT-07"],
      "validates": ["META", "WAX"],
      "testable": true,
      "references": ["Arrow (1951)"]
    },
    {
      "id": "MA-ONT-14",
      "category": "ontology",
      "level": "operation",
      "statement": "λ: Spannungs-Regulator",
      "description": "Reguliert lokal vs. global Orientierung",
      "formula": "U_eff = (1-λ) · U_lok + λ · κ(U_lok, U_komp)",
      "dependencies": ["MA-ONT-12", "MA-ONT-13"],
      "validates": ["WAX"],
      "testable": true
    },
    {
      "id": "MA-ONT-15",
      "category": "ontology",
      "level": "operation",
      "statement": "λ ∈ [0, 1]: Hybrid-Kontinuum",
      "description": "Lambda ist kontextabhängig",
      "formula": "λ = f(ρ, σ, τ)",
      "dependencies": ["MA-ONT-14"],
      "validates": ["WAX"],
      "testable": true
    },
    {
      "id": "MA-ONT-16",
      "category": "ontology",
      "level": "operation",
      "statement": "ω: Gewichtungsfunktion",
      "description": "Dimensionen haben Gewichte",
      "formula": "ω: D → [0, 1], Σ ω_d = 1",
      "dependencies": ["MA-ONT-08"],
      "validates": ["INU"],
      "testable": true
    },
    {
      "id": "MA-ONT-17",
      "category": "ontology",
      "level": "operation",
      "statement": "π: Identitäts-Aktivierung",
      "description": "Identitäten haben Aktivierungswahrscheinlichkeiten",
      "formula": "π: I × ρ → [0, 1], Σ π_j = 1",
      "dependencies": ["MA-ONT-09"],
      "validates": ["IDN"],
      "testable": true
    },
    {
      "id": "MA-ONT-18",
      "category": "ontology",
      "level": "operation",
      "statement": "A: Alignment-Funktion",
      "description": "Verhalten hat Alignment mit Identität",
      "formula": "A: V × I → [-1, 1]",
      "dependencies": ["MA-ONT-09", "MA-ONT-02"],
      "validates": ["IDN"],
      "testable": true
    },
    {
      "id": "MA-ONT-19",
      "category": "ontology",
      "level": "dynamics",
      "statement": "∂U/∂τ: Nutzen ist zeitabhängig",
      "description": "Nutzen verändert sich über Zeit",
      "formula": "U(τ+Δτ) = U(τ) + ∂U/∂τ · Δτ + ε",
      "dependencies": ["MA-ONT-03", "MA-ONT-05"],
      "validates": ["WTX"],
      "testable": true
    },
    {
      "id": "MA-ONT-20",
      "category": "ontology",
      "level": "dynamics",
      "statement": "Habituation existiert",
      "description": "Wiederholung reduziert Nutzen",
      "formula": "∂U/∂n < 0 für n → ∞",
      "dependencies": ["MA-ONT-19"],
      "validates": ["INU", "WTX"],
      "testable": true
    },
    {
      "id": "MA-ONT-21",
      "category": "ontology",
      "level": "dynamics",
      "statement": "Feedback-Schleifen existieren",
      "description": "Verhalten beeinflusst zukünftigen Nutzen",
      "formula": "U(τ+1) = f(U(τ), V(τ))",
      "dependencies": ["MA-ONT-19"],
      "validates": ["WTX"],
      "testable": true
    },
    {
      "id": "MA-ONT-22",
      "category": "ontology",
      "level": "dynamics",
      "statement": "Spillover existiert",
      "description": "Verhalten in einem Bereich beeinflusst andere",
      "formula": "∂U_j/∂V_i ≠ 0 für i ≠ j",
      "dependencies": ["MA-ONT-21"],
      "validates": ["INU", "KNU"],
      "testable": true
    },
    {
      "id": "MA-ONT-23",
      "category": "ontology",
      "level": "dynamics",
      "statement": "Identitäten evolvieren",
      "description": "Identitätslandschaft verändert sich",
      "formula": "I(τ+Δτ) ≠ I(τ)",
      "dependencies": ["MA-ONT-09", "MA-ONT-05"],
      "validates": ["IDN"],
      "testable": true
    },
    {
      "id": "MA-ONT-24",
      "category": "ontology",
      "level": "dynamics",
      "statement": "Normen evolvieren",
      "description": "Soziale Normen verändern sich",
      "formula": "N(τ+Δτ) = N(τ) + μ_N · ΔN",
      "dependencies": ["MA-ONT-11", "MA-ONT-05"],
      "validates": ["KNU"],
      "testable": true
    },
    {
      "id": "MA-ONT-25",
      "category": "ontology",
      "level": "dynamics",
      "statement": "Meta-Evolution existiert",
      "description": "Regeln der Veränderung verändern sich",
      "formula": "μ(τ+Δτ) ≠ μ(τ)",
      "dependencies": ["MA-ONT-19"],
      "validates": ["META"],
      "testable": false
    },
    {
      "id": "MA-EPI-01",
      "category": "epistemology",
      "level": "foundation",
      "statement": "Unvollständiges Wissen",
      "description": "Wissen über Nutzen ist immer unvollständig",
      "formula": "K(U) ⊂ U",
      "dependencies": ["MA-ONT-03"],
      "validates": ["AWX"],
      "testable": true
    },
    {
      "id": "MA-EPI-02",
      "category": "epistemology",
      "level": "foundation",
      "statement": "Bounded Rationality",
      "description": "Rationalität ist begrenzt",
      "formula": "R_actual < R_optimal",
      "dependencies": ["MA-EPI-01"],
      "validates": ["INU", "AWX"],